ID,post_title,post_name,post_date,post_parent
10099,"SSQII Packages Pricing Sheet",ssqii-packages-price-sheet,"2023-12-22 09:12:00",0
4018,"BG7 Gutter Machine Pricing Sheet",bg7-gutter-machine-pricing-sheet,"2022-02-22 11:49:58",0
4015,"MACH II 5"", 6"", and 5""/6"" Combo Gutter Machine Pricing Sheet",mach-ii-gutter-machine-pricing-sheet,"2022-02-22 11:49:50",0
4014,"WAV Wall Panel Machine Pricing Sheet",wav-wall-panel-machine-pricing-sheet,"2022-02-22 11:49:50",0
4013,"SSR Roof Panel Machine Pricing Sheet",ssr-roof-panel-machine-pricing-sheet,"2022-02-22 11:49:50",0
4012,"SSH Roof Panel Machine Pricing Sheet",ssh-roof-panel-machine-pricing-sheet,"2022-02-22 11:49:44",0
4010,"SSQII Roof Panel Machine Pricing",ssqii-roof-panel-machine-pricing,"2022-02-22 11:49:44",0
892,"5VC Crimp Roof Panel Machine Pricing Sheet",5vc-price-sheet-2024,"2021-03-10 19:30:44",0
